{"artifacts":[{"artifact_id":"fedora-44-x86_64-user-archive","byte_count":10263,"extraction_limits":{"max_entries":64,"max_file_bytes":524288,"max_path_bytes":256,"max_total_bytes":1048576},"name":"tongs-desktop-1.2.3-fedora44-x86_64.synthetic.tar.gz","ownership":"per-user","package_kind":"user-archive","platform":{"abi":"gnu","architecture":"x86_64","distribution":"fedora","distribution_version":"44","operating_system":"linux"},"sha256":"68bac2b7c7c0d9d2a861ed1ee26cd9280360ec77b9dd873d7902060cceec4c11"}],"compatibility":{"core_maximum_exclusive":"2.0.0","core_minimum":"1.2.0","plugin_api_major":1,"rpc_api_major":1},"release_version":"1.2.3","schema_version":1,"source_commit":"0123456789abcdef0123456789abcdef01234567"}
